{
  "approval": {
    "approvedAt": "2026-07-16",
    "approvedBy": "HUY",
    "status": "approved"
  },
  "collectorVersion": "w8-link-note-collector/1",
  "domain": "visual-style",
  "provenance": {
    "collectorArtifact": "design/knowledge/reference-approvals/web/w8-technical-reveal-code.sanitized-approved.json",
    "sanitizedArtifactChecksum": "70283842fe0003f174960a41c0fe08ce6f05a73fd66698b4f673f0bd0cebb887"
  },
  "rights": {
    "evidence": "HUY approved these reviewer-authored link notes on 2026-07-17; no third-party source bodies or media are vendored.",
    "policy": "link-and-review-note-only",
    "status": "approved"
  },
  "schemaVersion": "lucida-reference-source/v1",
  "snapshotChecksum": "12bcde6e9db55924c1202e6f3575744e04f9c3c9aa55939d15478112baf35c04",
  "sourceId": "source:reference:w8-technical-reveal-code",
  "sourceRef": "https://revealjs.com/code/",
  "sourceRevision": "link-note:2026-07-16",
  "sourceType": "web"
}
