{
  "approval": {
    "approvedAt": "2026-07-16",
    "approvedBy": "HUY",
    "status": "approved"
  },
  "collectorVersion": "w9-factual-link-note-collector/1",
  "domain": "factual",
  "provenance": {
    "collectorArtifact": "design/knowledge/reference-approvals/web/openai-gpt-5-6-official.sanitized-approved.json",
    "sanitizedArtifactChecksum": "e211d5ddbde58f923f4ffb54ae89d6c961a278c35b4d5799438bfcdf4b816eba"
  },
  "rights": {
    "evidence": "HUY approved these reviewer-authored link notes on 2026-07-17; no third-party source bodies or media are vendored.",
    "policy": "link-and-review-note-only",
    "status": "approved"
  },
  "schemaVersion": "lucida-reference-source/v1",
  "snapshotChecksum": "57d85932a3043ffe3b267046af61de16a704e18de811155581347f8afa378747",
  "sourceId": "source:reference:openai-gpt-5-6-official",
  "sourceRef": "https://openai.com/index/gpt-5-6/",
  "sourceRevision": "openai-release:2026-07-09|link-note:2026-07-16",
  "sourceType": "web"
}
