{
  "approval": {
    "approvedAt": "2026-07-16",
    "approvedBy": "HUY",
    "status": "approved"
  },
  "collectorVersion": "w8-link-note-collector/1",
  "domain": "visual-style",
  "provenance": {
    "collectorArtifact": "design/knowledge/reference-approvals/repository/w8-technical-primer-primitives.sanitized-approved.json",
    "sanitizedArtifactChecksum": "2b6b116b9e3ffb93fcd3eb02ce16b88da702a7a2ad74d973805955b7b8c41f3b"
  },
  "rights": {
    "evidence": "HUY approved these reviewer-authored link notes on 2026-07-17; no third-party source bodies or media are vendored.",
    "policy": "link-and-review-note-only",
    "status": "approved"
  },
  "schemaVersion": "lucida-reference-source/v1",
  "snapshotChecksum": "d2aaddd576a92ab279d2e0ebdcbeb6ecb56763196787b0ac66502b22f2cd7603",
  "sourceId": "source:reference:w8-technical-primer-primitives",
  "sourceRef": "https://github.com/primer/primitives",
  "sourceRevision": "git:b447200fa097165c956c5833031c15608dbe6094",
  "sourceType": "repository"
}
